{
  "artifactRoot": "complete_run",
  "contractVersion": "us-runtime-stages-v2",
  "generatedAt": "2026-06-03T00:00:00+00:00",
  "graphSchemaVersion": 1,
  "manifest": "manifest.json",
  "pipeline": "us_microplex",
  "schemaVersion": 1,
  "stages": [
    {
      "artifacts": [
        {
          "description": "Top-level artifact manifest with resolved config.",
          "exists": true,
          "format": "json",
          "key": "manifest",
          "path": "manifest.json",
          "referenced": true,
          "required": true,
          "resumeRole": null
        }
      ],
      "benchmarkSummary": {},
      "completedAt": null,
      "deferredReason": null,
      "diagnostics": [
        {
          "key": "resolved provider names"
        },
        {
          "key": "sample/query filters"
        },
        {
          "key": "target period"
        },
        {
          "key": "baseline dataset and target DB references"
        }
      ],
      "failedAt": null,
      "failure": null,
      "id": "01_run_profile",
      "lifecycleStatus": "complete",
      "metrics": [
        {
          "label": "Target period",
          "value": null
        },
        {
          "label": "Backend",
          "value": "entropy"
        }
      ],
      "outputManifest": null,
      "resume": {
        "mode": "metadata_only",
        "notes": "The resolved config can be reused, but this stage does not contain reloadable data by itself."
      },
      "startedAt": null,
      "status": "ready",
      "title": "Run profile, config, and source bundle",
      "updatedAt": null,
      "validations": [
        {
          "description": "Check required paths and context for the selected profile.",
          "key": "config_context",
          "status": "planned"
        }
      ]
    },
    {
      "artifacts": [],
      "benchmarkSummary": {},
      "completedAt": null,
      "deferredReason": null,
      "diagnostics": [
        {
          "key": "source row counts"
        },
        {
          "key": "entity coverage"
        },
        {
          "key": "relationship validity"
        },
        {
          "key": "cache/download provenance"
        }
      ],
      "failedAt": null,
      "failure": null,
      "id": "02_source_loading",
      "lifecycleStatus": "pending",
      "metrics": [
        {
          "label": "Sources",
          "value": 2
        }
      ],
      "outputManifest": null,
      "resume": {
        "mode": "none",
        "notes": "Full source-frame snapshotting is not implemented yet."
      },
      "startedAt": null,
      "status": "metadata_only",
      "title": "Source contracts and source loading",
      "updatedAt": null,
      "validations": [
        {
          "description": "Validate required entity tables and relationships for each source.",
          "key": "observation_frame_validity",
          "status": "planned"
        }
      ]
    },
    {
      "artifacts": [
        {
          "description": "Compact JSON summary of source names, scaffold, and donor variable plan.",
          "exists": true,
          "format": "json",
          "key": "source_plan",
          "path": "stage_artifacts/03_source_planning/source_plan.json",
          "referenced": true,
          "required": true,
          "resumeRole": "diagnostic"
        }
      ],
      "benchmarkSummary": {},
      "completedAt": null,
      "deferredReason": null,
      "diagnostics": [
        {
          "key": "source score summary"
        },
        {
          "key": "coverage matrix"
        },
        {
          "key": "scaffold source"
        },
        {
          "key": "donor source names"
        }
      ],
      "failedAt": null,
      "failure": null,
      "id": "03_source_planning",
      "lifecycleStatus": "complete",
      "metrics": [
        {
          "label": "Scaffold",
          "value": "cps_asec_2023"
        }
      ],
      "outputManifest": null,
      "resume": {
        "mode": "metadata_only",
        "notes": "The source plan explains the build route; raw source frames are not reloadable from this artifact yet."
      },
      "startedAt": null,
      "status": "ready",
      "title": "Source planning, fusion planning, and scaffold selection",
      "updatedAt": null,
      "validations": [
        {
          "description": "Check that the scaffold has household/person observations and a valid relationship.",
          "key": "scaffold_has_households_and_persons",
          "status": "planned"
        }
      ]
    },
    {
      "artifacts": [
        {
          "description": "Seed population immediately after scaffold projection and before donor integration.",
          "exists": true,
          "format": "parquet_dataframe",
          "key": "scaffold_seed_data",
          "path": "stage_artifacts/04_seed_scaffold/scaffold_seed_data.parquet",
          "referenced": true,
          "required": true,
          "resumeRole": "manual_replay"
        }
      ],
      "benchmarkSummary": {},
      "completedAt": null,
      "deferredReason": null,
      "diagnostics": [
        {
          "key": "scaffold source"
        },
        {
          "key": "pre-donor seed rows and columns"
        },
        {
          "key": "canonical identifier coverage"
        },
        {
          "key": "required seed column defaults"
        }
      ],
      "failedAt": null,
      "failure": null,
      "id": "04_seed_scaffold",
      "lifecycleStatus": "complete",
      "metrics": [
        {
          "label": "Seed rows",
          "value": 100
        },
        {
          "label": "Scaffold",
          "value": "cps_asec_2023"
        }
      ],
      "outputManifest": null,
      "resume": {
        "mode": "manual_replay",
        "notes": "The pre-donor seed frame is saved for diagnostics and manual replay; automatic donor-stage resume is not implemented yet."
      },
      "startedAt": null,
      "status": "ready",
      "title": "Seed/scaffold construction",
      "updatedAt": null,
      "validations": [
        {
          "description": "Check canonical identifiers and required seed columns.",
          "key": "seed_schema",
          "status": "planned"
        }
      ]
    },
    {
      "artifacts": [
        {
          "description": "Seed population after donor integration and semantic guards.",
          "exists": true,
          "format": "parquet_dataframe",
          "key": "seed_data",
          "path": "seed_data.parquet",
          "referenced": true,
          "required": true,
          "resumeRole": "diagnostic"
        },
        {
          "description": "Candidate population before final calibration.",
          "exists": true,
          "format": "parquet_dataframe",
          "key": "synthetic_data",
          "path": "synthetic_data.parquet",
          "referenced": true,
          "required": true,
          "resumeRole": "manual_replay"
        },
        {
          "description": "Optional fitted synthesis model.",
          "exists": false,
          "format": "model_file",
          "key": "synthesizer",
          "path": "synthesizer.pt",
          "referenced": false,
          "required": false,
          "resumeRole": "diagnostic"
        },
        {
          "description": "Diagnostic summary of source-level contribution weights.",
          "exists": false,
          "format": "json",
          "key": "source_weight_diagnostics",
          "path": "source_weight_diagnostics.json",
          "referenced": false,
          "required": false,
          "resumeRole": "diagnostic"
        }
      ],
      "benchmarkSummary": {},
      "completedAt": null,
      "deferredReason": null,
      "diagnostics": [
        {
          "key": "donor-integrated variables"
        },
        {
          "key": "conditioning diagnostics"
        },
        {
          "key": "authoritative override variables"
        },
        {
          "key": "synthesis backend"
        },
        {
          "key": "condition variables"
        },
        {
          "key": "target variables"
        },
        {
          "key": "support enforcement changes"
        }
      ],
      "failedAt": null,
      "failure": null,
      "id": "05_donor_integration_synthesis",
      "lifecycleStatus": "complete",
      "metrics": [
        {
          "label": "Seed rows",
          "value": 100
        },
        {
          "label": "Integrated vars",
          "value": 1
        },
        {
          "label": "Backend",
          "value": "seed"
        },
        {
          "label": "Synthetic rows",
          "value": 100
        }
      ],
      "outputManifest": null,
      "resume": {
        "mode": "manual_replay",
        "notes": "Existing policy-stage replay can reload synthetic_data.parquet and rerun downstream PE work."
      },
      "startedAt": null,
      "status": "ready",
      "title": "Donor integration, synthesis, and support enforcement",
      "updatedAt": null,
      "validations": [
        {
          "description": "Check that candidate rows support requested marginal target cells.",
          "key": "candidate_support",
          "status": "planned"
        }
      ]
    },
    {
      "artifacts": [
        {
          "description": "Reloadable pre-calibration PE entity-table bundle saved as parquet files plus metadata.",
          "exists": true,
          "format": "policyengine_entity_bundle",
          "key": "pre_calibration_policyengine_entity_tables",
          "path": "stage_artifacts/06_policyengine_entities/metadata.json",
          "referenced": true,
          "required": true,
          "resumeRole": "manual_resume"
        }
      ],
      "benchmarkSummary": {},
      "completedAt": null,
      "deferredReason": null,
      "diagnostics": [
        {
          "key": "entity row counts"
        },
        {
          "key": "ID/link integrity"
        },
        {